{
    "$schema": "http://json-schema.org/draft-07/schema#",
    "type": "object",
    "properties": {
      "version": {
        "type": "integer",
        "maximum": 99
    },
      "bundle": {
        "type": "string",
        "minLength": 32,
        "maxLength": 32,
        "pattern": "^[0-9A-Z]{32}$"
      },
      "type": {
        "type": "string",
        "enum": ["story", "home", "race", "lyrics", "preview"]
      },
      "storyId": {
        "type": "string",
        "minLength": 4,
        "maxLength": 9,
        "pattern": "^[0-9]{4,9}$"
      },
      "title": {
        "type": "string",
        "minLength": 0
      },
      "lineLength": {"type": "integer"},
      "text": {
        "type": "array",
        "items": {
            "type": "object",
            "properties": {
              "jpName": {"type": "string"},
              "enName": {"type": "string"},
              "jpText": {"type": "string"},
              "enText": {"type": "string"},
              "nextBlock": {"type": "integer"},
              "origClipLength": {"type": "integer"},
              "pathId": {"type": "integer"},
              "blockIdx": {"type": "integer"},
              "time": {"type": "string"},
              "skip": {"type": "boolean"},
              "animData": {
                "type": "array",
                "items": {
                    "type": "object",
                    "properties": {
                      "origLen": {"type": "integer"},
                      "pathId": {"type": "integer"}
                    },
                    "required": [
                      "origLen",
                      "pathId"
                    ]
                  }
              }
            },
            "required": [
              "jpText",
              "enText"
             ]
          }
      },
      "modified": {
        "type": "integer",
        "format": "date-time"
      }
    },
    "required": [
      "version",
      "bundle",
      "type",
      "text"
    ]
  }