{
    "version": 5,
    "bundle": "G4ZXL26G3KLNXNMDPQ7CKPHHLAORDTD4",
    "type": "story",
    "storyId": "501039730",
    "title": "クレーンゲーム大成功！",
    "text": [
        {
            "jpName": "カワカミプリンセス",
            "enName": "Kawakami Princess",
            "jpText": "すごい！　すごすぎですわっ！\r\nこんなにも爆盛りだなんて！",
            "enText": "That's amazing! This is too much! I can't \nbelieve it's such a big party!",
            "nextBlock": 2,
            "origClipLength": 82,
            "animData": [
                {
                    "origLen": 114,
                    "pathId": 2219669649008595230
                },
                {
                    "origLen": 93,
                    "pathId": -6112405689257286344
                },
                {
                    "origLen": 93,
                    "pathId": -2348556259174309717
                }
            ],
            "pathId": 4028246767024755467,
            "blockIdx": 1
        },
        {
            "jpName": "カワカミプリンセス",
            "enName": "Kawakami Princess",
            "jpText": "これだけあればトレーナー室に\r\nぬいぐるみ王国が作れちゃいますわね！",
            "enText": "With all this stuff, I could build a stuffed \nanimal kingdom in my trainer's office!",
            "nextBlock": 3,
            "origClipLength": 89,
            "choices": [
                {
                    "jpText": "賑やかになりそうだな",
                    "enText": "It's going to be lively.",
                    "nextBlock": 3
                },
                {
                    "jpText": "賑やかになりそうだね",
                    "enText": "It's going to be lively.",
                    "nextBlock": 3
                }
            ],
            "animData": [
                {
                    "origLen": 21,
                    "pathId": 6853592201786966324
                },
                {
                    "origLen": 100,
                    "pathId": 1647251435513990713
                },
                {
                    "origLen": 100,
                    "pathId": -8137497892195528148
                }
            ],
            "pathId": -3520235179924688018,
            "blockIdx": 2
        },
        {
            "jpName": "カワカミプリンセス",
            "enName": "Kawakami Princess",
            "jpText": "ふふっ、今日から私はぬいぐるみ王国の姫っ！",
            "enText": "From now on, I am the princess of the stuffed \nanimal kingdom!",
            "nextBlock": 4,
            "origClipLength": 72,
            "animData": [
                {
                    "origLen": 125,
                    "pathId": -7710232602651585910
                },
                {
                    "origLen": 83,
                    "pathId": 5547473534840833422
                },
                {
                    "origLen": 83,
                    "pathId": 6510679914546694282
                }
            ],
            "pathId": -4631291720976924415,
            "blockIdx": 3
        },
        {
            "jpName": "カワカミプリンセス",
            "enName": "Kawakami Princess",
            "jpText": "これからはこの子たちの応援も受けて\r\n姫、頑張っちゃいますわよ～！！",
            "enText": "From now on, with the support of these girls, \nPrincess, I will do my best～!",
            "nextBlock": 5,
            "origClipLength": 89,
            "animData": [
                {
                    "origLen": 125,
                    "pathId": 1709051156253672872
                },
                {
                    "origLen": 100,
                    "pathId": 5540119877124918457
                },
                {
                    "origLen": 100,
                    "pathId": 3048242641623568758
                }
            ],
            "pathId": 1695063150813977479,
            "blockIdx": 4
        },
        {
            "jpName": "",
            "enName": "",
            "jpText": "――大満足の結果だった！",
            "enText": "―I was very pleased with the results!",
            "nextBlock": -1,
            "origClipLength": 60,
            "animData": [
                {
                    "origLen": 20,
                    "pathId": 6405453273971546014
                },
                {
                    "origLen": 71,
                    "pathId": 3066995139809292951
                },
                {
                    "origLen": 71,
                    "pathId": -1307807067342350611
                }
            ],
            "pathId": -8459258910013980315,
            "blockIdx": 5
        }
    ],
    "modified": 1662157581
}