{
    "version": 5,
    "bundle": "KFPPAOTHO7G7DK6J2UCCU3PN5WHT3GD5",
    "type": "story",
    "storyId": "501036900",
    "title": "自己紹介",
    "text": [
        {
            "jpName": "モノローグ",
            "enName": "",
            "jpText": "これから、トゥインクル・シリーズを\n担当ウマ娘と駆け抜ける日々が始まる。\nともに歩む彼女の名前は――",
            "enText": "From now on, the days of running through the \nTwinkle Series with the horsegirl in charge \nwill begin. Her name is…",
            "nextBlock": 2,
            "origClipLength": 110,
            "coloredText": [
                {
                    "jpText": "トゥインクル・シリーズ",
                    "enText": "Twinkle Series"
                }
            ],
            "pathId": 4292576588883909284,
            "blockIdx": 1
        },
        {
            "jpName": "エアシャカール",
            "enName": "Air Shakur",
            "jpText": "エアシャカールだ。言っとくが、\nアンタにはなにも期待してねェ。",
            "enText": "It's Air Shakur. I'm telling you, I don't \nexpect anything from you.",
            "nextBlock": 3,
            "origClipLength": 85,
            "coloredText": [
                {
                    "jpText": "エアシャカール",
                    "enText": "air shackard"
                }
            ],
            "animData": [
                {
                    "origLen": 70,
                    "pathId": -7966111817374665967
                },
                {
                    "origLen": 65,
                    "pathId": 547172218505453440
                }
            ],
            "pathId": -1755508489654882176,
            "blockIdx": 2
        },
        {
            "jpName": "エアシャカール",
            "enName": "Air Shakur",
            "jpText": "一応提案は聞いてやるが、決めるのはオレだ。\nそれをちゃんと理解しとけよ。",
            "enText": "I'll listen to your suggestions, \nbut I'm the one who decides. Make \nsure you understand that.",
            "nextBlock": 4,
            "origClipLength": 91,
            "animData": [
                {
                    "origLen": 49,
                    "pathId": -1888551283540368065
                },
                {
                    "origLen": 102,
                    "pathId": 6529779490063383436
                }
            ],
            "pathId": -6605248837441635521,
            "blockIdx": 3
        },
        {
            "jpName": "エアシャカール",
            "enName": "Air Shakur",
            "jpText": "もしオレの邪魔をしやがったら、\nそこでお前との契約はお終い。\nそれを肝に銘じておけ。",
            "enText": "If you interfere with me, your contract is \nover. Keep that in mind.",
            "nextBlock": 5,
            "origClipLength": 99,
            "animData": [
                {
                    "origLen": 62,
                    "pathId": -2295147762461878718
                },
                {
                    "origLen": 110,
                    "pathId": -7960160532304728451
                }
            ],
            "pathId": -2761957454676145649,
            "blockIdx": 4
        },
        {
            "jpName": "モノローグ",
            "enName": "",
            "jpText": "こうして、<chrname>との\nトゥインクル・シリーズへの挑戦が\n始まったのだった！",
            "enText": "And so began <chrname>'s attempt at the \nTwinkle Series!",
            "nextBlock": -1,
            "origClipLength": 101,
            "animData": [
                {
                    "origLen": 112,
                    "pathId": 5529074286702042914
                },
                {
                    "origLen": 112,
                    "pathId": -6198183166847393668
                }
            ],
            "pathId": 2697453733545238257,
            "blockIdx": 5
        }
    ],
    "modified": 1657513099
}