{
    "version": 5,
    "bundle": "COEVEYNKT2PV6Z6KQD3VYRG37TYAGZPP",
    "type": "story",
    "storyId": "501062415",
    "title": "ダイヤモンドSにむけて",
    "text": [
        {
            "jpName": "モノローグ",
            "enName": "",
            "jpText": "『ダイヤモンドS』当日。\r\nレース場前でファンに声をかけられたり――",
            "enText": "It was the day of the \"Diamond S.\" I was \napproached by fans in front of the \nracecourse. Fans called out to me in front of \nthe racecourse.",
            "nextBlock": 2,
            "origClipLength": 89,
            "animData": [
                {
                    "origLen": 133,
                    "pathId": -7595155336171077904
                },
                {
                    "origLen": 108,
                    "pathId": 5464112646464367785
                }
            ],
            "pathId": 8814345712670085359,
            "blockIdx": 1
        },
        {
            "jpName": "モノローグ",
            "enName": "",
            "jpText": "以前、学内で出会った丸眼鏡の記者から、\r\n『タンホイザさんの言葉に救われた』\nと前向きに勝利を目指す姿を称賛されたり。",
            "enText": "A journalist with round glasses I once met on \ncampus said, \"Ms. Tanhiza's words saved my \nlife. and praised her positive attitude \ntoward winning.",
            "nextBlock": 3,
            "origClipLength": 121,
            "animData": [
                {
                    "origLen": 133,
                    "pathId": 1210372016199152166
                },
                {
                    "origLen": 146,
                    "pathId": 3332487374413828645
                }
            ],
            "pathId": 7422502810174240711,
            "blockIdx": 2
        },
        {
            "jpName": "モノローグ",
            "enName": "",
            "jpText": "様々な人々から背中を押され挑む、\r\n『ダイヤモンドS』となった！",
            "enText": "With the support and encouragement \nof many people, I took on the challenge \nof the \"Diamond S\"!",
            "nextBlock": -1,
            "origClipLength": 86,
            "animData": [
                {
                    "origLen": 133,
                    "pathId": 1052394020724044920
                },
                {
                    "origLen": 108,
                    "pathId": 9205842838373441235
                }
            ],
            "pathId": 5320721876823262974,
            "blockIdx": 3
        }
    ],
    "modified": 1657434070
}