{
    "version": 5,
    "bundle": "UDIWVBRXGONMGSCH6TX2JQZBRLC6ZS43",
    "type": "story",
    "storyId": "501035715",
    "title": "追加の自主トレ",
    "text": [
        {
            "jpName": "",
            "enName": "",
            "jpText": "トレーニング終了後……。",
            "enText": "After the training is over, visit ……",
            "nextBlock": 2,
            "origClipLength": 60,
            "choices": [
                {
                    "jpText": "お疲れ様",
                    "enText": "that's enough for today",
                    "nextBlock": 2
                }
            ],
            "animData": [
                {
                    "origLen": 71,
                    "pathId": 4213486796393733132
                },
                {
                    "origLen": 71,
                    "pathId": 63537350753335207
                }
            ],
            "pathId": 8313873919088983720,
            "blockIdx": 1
        },
        {
            "jpName": "ウイニングチケット",
            "enName": "Winning Ticket",
            "jpText": "うんっ！　ありがとー！\r\nトレーナーさんもお疲れ様――",
            "enText": "Yeah! Thanks! Thanks to the trainer, too.",
            "nextBlock": 3,
            "origClipLength": 80,
            "animData": [
                {
                    "origLen": 62,
                    "pathId": 3137992636105322547
                },
                {
                    "origLen": 91,
                    "pathId": 923572932104656476
                }
            ],
            "pathId": 5482527780859948546,
            "blockIdx": 2
        },
        {
            "jpName": "ウイニングチケット",
            "enName": "Winning Ticket",
            "jpText": "って……んん？　あれあれっ……？\r\nアタシ、全力でトレーニングしてたのに――",
            "enText": "What is ……? What's that? ……? I was training \nas hard as I could…",
            "nextBlock": 4,
            "origClipLength": 94,
            "animData": [
                {
                    "origLen": 83,
                    "pathId": 930718956928105265
                },
                {
                    "origLen": 105,
                    "pathId": -7026038188314190150
                }
            ],
            "pathId": 1464108181668238148,
            "blockIdx": 3
        },
        {
            "jpName": "ウイニングチケット",
            "enName": "Winning Ticket",
            "jpText": "あんまり、お疲れ様じゃないぞーっ！？",
            "enText": "Not much, you're not tired!",
            "nextBlock": 5,
            "origClipLength": 68,
            "animData": [
                {
                    "origLen": 51,
                    "pathId": -528062574495464617
                },
                {
                    "origLen": 79,
                    "pathId": 3210602089625833673
                }
            ],
            "pathId": -4812944918155020735,
            "blockIdx": 4
        },
        {
            "jpName": "ウイニングチケット",
            "enName": "Winning Ticket",
            "jpText": "きっと、今日は調子がドッカーンなんだぁ！\r\nこれなら、まだまだトレーニングできるよ！",
            "enText": "I must be in smashing shape today! This means \nI can still train!",
            "nextBlock": 6,
            "origClipLength": 99,
            "animData": [
                {
                    "origLen": 62,
                    "pathId": -7348220353020911275
                },
                {
                    "origLen": 110,
                    "pathId": -6005253288102275068
                }
            ],
            "pathId": 4836842094210794471,
            "blockIdx": 5
        },
        {
            "jpName": "ウイニングチケット",
            "enName": "Winning Ticket",
            "jpText": "トレーナーさん！\r\nアタシ、自主トレしてくるねーっ！",
            "enText": "Trainer! I'm going to go train by myself!",
            "nextBlock": 7,
            "origClipLength": 78,
            "choices": [
                {
                    "jpText": "よし！やろう！",
                    "enText": "Let's do it! Let's do it!",
                    "nextBlock": 8
                },
                {
                    "jpText": "よし！やりましょう！",
                    "enText": "Let's do it! Let's do it!",
                    "nextBlock": 8
                },
                {
                    "jpText": "全力は後にとっておこう",
                    "enText": "Let's save our best for later.",
                    "nextBlock": 11
                }
            ],
            "animData": [
                {
                    "origLen": 51,
                    "pathId": 1040534060981930439
                },
                {
                    "origLen": 89,
                    "pathId": -2316574898388053774
                }
            ],
            "pathId": 7255902171096392673,
            "blockIdx": 6
        },
        {
            "jpName": "ウイニングチケット",
            "enName": "Winning Ticket",
            "jpText": "トレーナーさん！\r\nアタシ、自主トレしてくるねーっ！",
            "enText": "Trainer! I'm going to go train by myself!",
            "nextBlock": 8,
            "origClipLength": 78,
            "choices": [
                {
                    "jpText": "よし！やろう！",
                    "enText": "Let's do it! Let's do it!",
                    "nextBlock": 8
                },
                {
                    "jpText": "よし！やりましょう！",
                    "enText": "Let's do it! Let's do it!",
                    "nextBlock": 8
                },
                {
                    "jpText": "全力は後にとっておこう",
                    "enText": "Let's save our best for later.",
                    "nextBlock": 11
                }
            ],
            "animData": [
                {
                    "origLen": 51,
                    "pathId": -4989991977821928768
                },
                {
                    "origLen": 89,
                    "pathId": -2808232746616545145
                }
            ],
            "pathId": 6745875608843499083,
            "blockIdx": 7
        },
        {
            "jpName": "ウイニングチケット",
            "enName": "Winning Ticket",
            "jpText": "おーーーー！！\r\nがんばるぞーーーっ！！",
            "enText": "Ooooooooo!!! I'll do my best!!!!",
            "nextBlock": 9,
            "origClipLength": 71,
            "animData": [
                {
                    "origLen": 59,
                    "pathId": 1142617071378039624
                },
                {
                    "origLen": 82,
                    "pathId": 8285473278605269961
                }
            ],
            "pathId": -3963589911091468659,
            "blockIdx": 8
        },
        {
            "jpName": "ウイニングチケット",
            "enName": "Winning Ticket",
            "jpText": "まずは、トレーニングコースをダッシュだぁ！\r\n全力ッ！　全開ッ！　レッツゴーーーッ！！",
            "enText": "First, let's dash down the training course! \nFull power! Full throttle! Let's goooooo!",
            "nextBlock": 10,
            "origClipLength": 101,
            "animData": [
                {
                    "origLen": 90,
                    "pathId": -5662744877522246727
                },
                {
                    "origLen": 112,
                    "pathId": -2425434201005113480
                }
            ],
            "pathId": -6489306294504196582,
            "blockIdx": 9
        },
        {
            "jpName": "",
            "enName": "",
            "jpText": "ウイニングチケットと一緒に、\r\n追加トレー二ングを行った。",
            "enText": "Additional training was provided along with \nthe winning ticket.",
            "nextBlock": -1,
            "origClipLength": 82,
            "animData": [
                {
                    "origLen": 93,
                    "pathId": -1696958696005099216
                },
                {
                    "origLen": 93,
                    "pathId": -6140869840130997255
                }
            ],
            "pathId": 6761979206343056853,
            "blockIdx": 10
        },
        {
            "jpName": "ウイニングチケット",
            "enName": "Winning Ticket",
            "jpText": "ハッ……！？！？\r\nな、なるほどぉ～～～！！",
            "enText": "Ha……! I see～!",
            "nextBlock": 12,
            "origClipLength": 73,
            "animData": [
                {
                    "origLen": 80,
                    "pathId": 3314694876340284581
                },
                {
                    "origLen": 84,
                    "pathId": 7123061089242438883
                }
            ],
            "pathId": 915269409662755609,
            "blockIdx": 11
        },
        {
            "jpName": "ウイニングチケット",
            "enName": "Winning Ticket",
            "jpText": "全力をとっておけば、もっと全力が出せるッ！\r\nさっすがトレーナーさん！\n気づかなかったよ～！",
            "enText": "If you save all your energy, you \ncan give it more! Way to go, trainer! \nI didn't even notice～!",
            "nextBlock": 13,
            "origClipLength": 105,
            "animData": [
                {
                    "origLen": 68,
                    "pathId": 4261881595750705403
                },
                {
                    "origLen": 116,
                    "pathId": 5103706972930689509
                }
            ],
            "pathId": 1387221920523950662,
            "blockIdx": 12
        },
        {
            "jpName": "",
            "enName": "",
            "jpText": "今後のトレーニングのためにも、\r\nウイニングチケットを休ませた。",
            "enText": "I rested my winnings ticket \nfor future training.",
            "nextBlock": -1,
            "origClipLength": 86,
            "animData": [
                {
                    "origLen": 97,
                    "pathId": 8489120819920273950
                },
                {
                    "origLen": 97,
                    "pathId": -684677793348918940
                }
            ],
            "pathId": 1552056884808463238,
            "blockIdx": 13
        }
    ],
    "modified": 1657555059
}