{
    "version": 5,
    "bundle": "37EWRL5AM6JYNHSLXK24EGSARXCVJTUS",
    "type": "story",
    "storyId": "501013731",
    "title": "クレーンゲーム成功！",
    "text": [
        {
            "jpName": "メジロマックイーン",
            "enName": "Mejiro McQueen",
            "jpText": "まあ……！　ありがとうございます！",
            "enText": "Well, ……! Thank you!",
            "nextBlock": 2,
            "origClipLength": 67,
            "animData": [
                {
                    "origLen": 79,
                    "pathId": -2150260599928452906
                },
                {
                    "origLen": 79,
                    "pathId": -7631918830594955418
                },
                {
                    "origLen": 89,
                    "pathId": -7242940428222355353
                }
            ],
            "pathId": 8232501724309812895,
            "blockIdx": 1
        },
        {
            "jpName": "メジロマックイーン",
            "enName": "Mejiro McQueen",
            "jpText": "細かいところまで作りこまれていて、\n間近で見ると、なお可愛いですわね！",
            "enText": "It's so detailed and pretty, and even \nprettier up close!",
            "nextBlock": 3,
            "origClipLength": 90,
            "animData": [
                {
                    "origLen": 30,
                    "pathId": 5052971794375843033
                },
                {
                    "origLen": 102,
                    "pathId": -1329902687061525039
                },
                {
                    "origLen": 102,
                    "pathId": -8476955235212646383
                }
            ],
            "pathId": -4449393503136395628,
            "blockIdx": 2
        },
        {
            "jpName": "メジロマックイーン",
            "enName": "Mejiro McQueen",
            "jpText": "ふふっ……大切にいたしますわ！",
            "enText": "Phew……… I will treasure it!",
            "nextBlock": 4,
            "origClipLength": 64,
            "animData": [
                {
                    "origLen": 68,
                    "pathId": -608459469946247953
                },
                {
                    "origLen": 79,
                    "pathId": -5537623933360562136
                },
                {
                    "origLen": 89,
                    "pathId": -2761863557381994984
                }
            ],
            "pathId": -2059797497510437973,
            "blockIdx": 3
        },
        {
            "jpName": "",
            "enName": "",
            "jpText": "――それなりの結果だった！",
            "enText": "―a reasonable result!",
            "nextBlock": -1,
            "origClipLength": 61,
            "animData": [
                {
                    "origLen": 73,
                    "pathId": 7593081140011772841
                },
                {
                    "origLen": 84,
                    "pathId": 6263423069622667568
                },
                {
                    "origLen": 93,
                    "pathId": -1450378246995502532
                }
            ],
            "pathId": 5866860618297645835,
            "blockIdx": 4
        }
    ],
    "modified": 1662157319
}