{
    "version": 5,
    "bundle": "GQT27ZXBC2SEOCMY7O6I6SVPFXJXEJDQ",
    "type": "story",
    "storyId": "501009414",
    "title": "日本ダービーにむけて",
    "text": [
        {
            "jpName": "",
            "enName": "",
            "jpText": "ウオッカの『日本ダービー』への熱い想いを\r\n偶然、耳にしたダイワスカーレットは――",
            "enText": "Daiwa Scarlet, who happened to overhear \nVodka's passion for the Japanese Derby, was…",
            "nextBlock": 2,
            "origClipLength": 71,
            "animData": [
                {
                    "origLen": 102,
                    "pathId": 7289108676144356465
                },
                {
                    "origLen": 89,
                    "pathId": -5922556831910359586
                }
            ],
            "pathId": -8027577165363802905,
            "blockIdx": 1
        },
        {
            "jpName": "",
            "enName": "",
            "jpText": "改めてウオッカに勝つこと、\r\n“1番”になることを心に決めるのだった。",
            "enText": "Once again, she made up her mind to beat \nVodka and become \"No. 1.",
            "nextBlock": -1,
            "origClipLength": 67,
            "animData": [
                {
                    "origLen": 102,
                    "pathId": 2754893890962648540
                },
                {
                    "origLen": 89,
                    "pathId": -3131894661826640559
                }
            ],
            "pathId": -3002596362406879117,
            "blockIdx": 2
        }
    ],
    "modified": 1657176600
}