{
    "version": 5,
    "bundle": "JEXO5JRVUQTYLTVMEH55T7PUA3IK7TNY",
    "type": "story",
    "storyId": "501037404",
    "title": "Die Chrysantheme",
    "text": [
        {
            "jpName": "モノローグ",
            "enName": "",
            "jpText": "1度は外した目標である『菊花賞』。\n調整が間に合い、挑戦することになったが――",
            "enText": "The Kikka-sho\" was a goal that she had once \nmissed. She made adjustments in time and \ndecided to take on the challenge, but…",
            "nextBlock": 2,
            "origClipLength": 95,
            "animData": [
                {
                    "origLen": 106,
                    "pathId": -2150192329480930340
                },
                {
                    "origLen": 107,
                    "pathId": 5203401868464812243
                }
            ],
            "pathId": -5085673946109470975,
            "blockIdx": 1
        },
        {
            "jpName": "モノローグ",
            "enName": "",
            "jpText": "エイシンフラッシュは次の目標を見ている。\nたとえ『菊花賞』であろうと、\nいつも通り結果を出すだけだ。",
            "enText": "Eishin Flash is looking at her next target. \nEven if it's the Kikka-sho. She just has to \nachieve the result as usual.",
            "nextBlock": -1,
            "origClipLength": 110,
            "animData": [
                {
                    "origLen": 121,
                    "pathId": -6531801342538123093
                },
                {
                    "origLen": 123,
                    "pathId": 6901735817207052166
                }
            ],
            "pathId": 2253205709475117594,
            "blockIdx": 2
        }
    ],
    "modified": 1657448261
}