{
    "version": 5,
    "bundle": "MWYJD6YN62LGUSVHJVDBBUANI7HM7WKL",
    "type": "story",
    "storyId": "501058701",
    "title": "休息はバッチリ！",
    "text": [
        {
            "jpName": "メイショウドトウ",
            "enName": "Meisho Doto",
            "jpText": "ふんふふ～ん、ふんふんふ～ん♪",
            "enText": "",
            "nextBlock": 2,
            "origClipLength": 64,
            "choices": [
                {
                    "jpText": "おはよう、鼻歌なんて珍しいな",
                    "enText": "Good morning. It's rare to see you humming.",
                    "nextBlock": 2
                },
                {
                    "jpText": "おはよう、鼻歌なんて珍しいね",
                    "enText": "Good morning. It's rare to see you humming.",
                    "nextBlock": 2
                }
            ],
            "animData": [
                {
                    "origLen": 75,
                    "pathId": 814311182725601480
                },
                {
                    "origLen": 75,
                    "pathId": 6759172295809636665
                }
            ],
            "pathId": -5539600000126088082,
            "blockIdx": 1
        },
        {
            "jpName": "メイショウドトウ",
            "enName": "Meisho Doto",
            "jpText": "ひゃわあ！　ト、トレーナーさんっ！？\r\nこ、これはつい、思い出にひたってと\nいいますか……っ。",
            "enText": "Whoa! You're a trainer! This \nis just a memory…………………",
            "nextBlock": 3,
            "origClipLength": 106,
            "animData": [
                {
                    "origLen": 89,
                    "pathId": 1855889767338351109
                },
                {
                    "origLen": 117,
                    "pathId": 5823935504914990916
                }
            ],
            "pathId": 6540193564535086972,
            "blockIdx": 2
        },
        {
            "jpName": "メイショウドトウ",
            "enName": "Meisho Doto",
            "jpText": "……実は昨日、偶然オペラオーさんに\r\n公園でお会いしまして……。",
            "enText": "…… In fact, I happened to meet Ms. Opera O in \nthe park yesterday. ……",
            "nextBlock": 4,
            "origClipLength": 86,
            "animData": [
                {
                    "origLen": 65,
                    "pathId": 2594663870018364267
                },
                {
                    "origLen": 97,
                    "pathId": 2257028704557633867
                }
            ],
            "pathId": -6563221966065939716,
            "blockIdx": 3
        },
        {
            "jpName": "メイショウドトウ",
            "enName": "Meisho Doto",
            "jpText": "なんと『オペラ覇王降臨・5時間特別版』を\r\n拝見することができたんですぅ～！",
            "enText": "I was able to see the special 5-hour \nedition of \"The Opera: The Descent \nof the Supreme King\"!",
            "nextBlock": 5,
            "origClipLength": 94,
            "animData": [
                {
                    "origLen": 84,
                    "pathId": -1528036871318989381
                },
                {
                    "origLen": 105,
                    "pathId": -2783591916996311905
                }
            ],
            "pathId": -3564323587353403093,
            "blockIdx": 4
        },
        {
            "jpName": "メイショウドトウ",
            "enName": "Meisho Doto",
            "jpText": "あの歌声を思い出すと、勇気が湧いてきます。\r\n今日はきっとドジらず過ごせる気がします～。",
            "enText": "Remembering that singing voice gives me \ncourage. I feel sure I will be able to spend \ntoday without screwing up～.",
            "nextBlock": 6,
            "origClipLength": 102,
            "animData": [
                {
                    "origLen": 100,
                    "pathId": 7492855543852852265
                },
                {
                    "origLen": 113,
                    "pathId": -6879957884825248659
                }
            ],
            "pathId": -8937873596832220456,
            "blockIdx": 5
        },
        {
            "jpName": "モノローグ",
            "enName": "",
            "jpText": "どうやら充実した休日を過ごせたようだ！",
            "enText": "Looks like you had a well-deserved holiday!",
            "nextBlock": -1,
            "origClipLength": 69,
            "animData": [
                {
                    "origLen": 80,
                    "pathId": 8878451300717687642
                },
                {
                    "origLen": 80,
                    "pathId": -3066090348296145876
                }
            ],
            "pathId": 5219849968501829555,
            "blockIdx": 6
        }
    ],
    "modified": 1657555062
}