{
    "version": 5,
    "bundle": "PLA2HAWHQT2CFMJMSMUWSGRIHYK4U2FX",
    "type": "story",
    "storyId": "501011201",
    "title": "朝日杯FSにむけて",
    "text": [
        {
            "jpName": "",
            "enName": "",
            "jpText": "いよいよ、『朝日杯フューチュリティ\r\nステークス』の当日を迎えた。",
            "enText": "Finally, the day of the \"Asahi Cup Futurity \nStakes\" arrived.",
            "nextBlock": 2,
            "origClipLength": 66,
            "animData": [
                {
                    "origLen": 77,
                    "pathId": 1395284352140134953
                },
                {
                    "origLen": 77,
                    "pathId": -6083342176704964723
                }
            ],
            "pathId": 6992503393210401755,
            "blockIdx": 1
        },
        {
            "jpName": "グラスワンダー",
            "enName": "Grass Wonder",
            "jpText": "さすがＧⅠレースですね～。\r\nスタンドがファンの方でいっぱいです。",
            "enText": "This is indeed a G1 race! The stands are \nfilled with fans.",
            "nextBlock": 3,
            "origClipLength": 85,
            "coloredText": [
                {
                    "jpText": "ＧⅠ",
                    "enText": "GI"
                }
            ],
            "animData": [
                {
                    "origLen": 43,
                    "pathId": -8383135649213466162
                },
                {
                    "origLen": 97,
                    "pathId": -447772184707923331
                }
            ],
            "pathId": 2908955814671405194,
            "blockIdx": 2
        },
        {
            "jpName": "グラスワンダー",
            "enName": "Grass Wonder",
            "jpText": "……トレーナーさんの緊張もひとしお、\r\nといったところでしょうか？",
            "enText": "…… trainers are also nervous, I guess.",
            "nextBlock": 4,
            "origClipLength": 66,
            "choices": [
                {
                    "jpText": "だ、だな……！",
                    "enText": "Duh, right. ……!",
                    "nextBlock": 4
                },
                {
                    "jpText": "だ、だね……！",
                    "enText": "Right, right. ……!",
                    "nextBlock": 4
                }
            ],
            "animData": [
                {
                    "origLen": 77,
                    "pathId": 3456168790622810063
                },
                {
                    "origLen": 77,
                    "pathId": -941069731910697602
                }
            ],
            "pathId": 825803125820022464,
            "blockIdx": 3
        },
        {
            "jpName": "グラスワンダー",
            "enName": "Grass Wonder",
            "jpText": "ふふっ。では今日も、緊張のご担当は\r\nトレーナーさんにお任せいたします♪",
            "enText": "Hmmm. Well, I'll leave it to your trainer to \ntake charge of your nerves today… ♪",
            "nextBlock": 5,
            "origClipLength": 68,
            "animData": [
                {
                    "origLen": 36,
                    "pathId": -15577824076174277
                },
                {
                    "origLen": 79,
                    "pathId": -7493560286652981105
                }
            ],
            "pathId": 3968085068418723014,
            "blockIdx": 4
        },
        {
            "jpName": "グラスワンダー",
            "enName": "Grass Wonder",
            "jpText": "――本日挑むのは『朝日杯FS』という\r\nレースだけではありません。",
            "enText": "―Today's challenge is not only \nthe \"Asahi Cup FS\" race.",
            "nextBlock": 6,
            "origClipLength": 66,
            "animData": [
                {
                    "origLen": 57,
                    "pathId": 4020178858291820286
                },
                {
                    "origLen": 77,
                    "pathId": 5987215944251749512
                }
            ],
            "pathId": 4006667859258092712,
            "blockIdx": 5
        },
        {
            "jpName": "グラスワンダー",
            "enName": "Grass Wonder",
            "jpText": "今現在、客席の方々の頭に浮かんでいるのは\r\nマルゼンスキーさんの名でしかないでしょう。",
            "enText": "Right now, the only name that comes \nto mind for those in the audience \nis that of Ms. Marzenski.",
            "nextBlock": 7,
            "origClipLength": 73,
            "animData": [
                {
                    "origLen": 45,
                    "pathId": -1117533583950365703
                },
                {
                    "origLen": 84,
                    "pathId": 5479905466016058219
                }
            ],
            "pathId": -648305128747104075,
            "blockIdx": 6
        },
        {
            "jpName": "グラスワンダー",
            "enName": "Grass Wonder",
            "jpText": "だからこそ……挑んで参ります。",
            "enText": "That is why we will be challenging ……",
            "nextBlock": 8,
            "origClipLength": 54,
            "animData": [
                {
                    "origLen": 39,
                    "pathId": -2612181976729140664
                },
                {
                    "origLen": 65,
                    "pathId": 2651066228624647661
                }
            ],
            "pathId": 7183890855370276645,
            "blockIdx": 7
        },
        {
            "jpName": "グラスワンダー",
            "enName": "Grass Wonder",
            "jpText": "“二世”でも“後継”でもない、\r\n頂点へ至る者としての実力を――",
            "enText": "Not as a second generation, not as a \nsuccessor, but as someone who has the ability \nto reach the top.",
            "nextBlock": 9,
            "origClipLength": 65,
            "animData": [
                {
                    "origLen": 100,
                    "pathId": 1863297758535408260
                },
                {
                    "origLen": 76,
                    "pathId": 3899708239890508582
                },
                {
                    "origLen": 76,
                    "pathId": 6108328668189849848
                }
            ],
            "pathId": -1687164267986976318,
            "blockIdx": 8
        },
        {
            "jpName": "グラスワンダー",
            "enName": "Grass Wonder",
            "jpText": "必ず、お見せして参ります。",
            "enText": "We will certainly show you.",
            "nextBlock": -1,
            "origClipLength": 53,
            "animData": [
                {
                    "origLen": 20,
                    "pathId": 6090090521095949173
                },
                {
                    "origLen": 24,
                    "pathId": 1509645241932435553
                },
                {
                    "origLen": 64,
                    "pathId": -4075429591469755847
                }
            ],
            "pathId": 2203220493816634508,
            "blockIdx": 9
        }
    ],
    "modified": 1657555055
}