{
    "version": 5,
    "bundle": "CSR6D54C43GTYUP4SSUM5ZFHJQ7H7SP3",
    "type": "story",
    "storyId": "400004051",
    "title": "クライマックス1戦目の後に",
    "text": [
        {
            "jpName": "秋川理事長",
            "enName": "Chairwoman Akikawa",
            "jpText": "～～っ！　感激ッ！！",
            "enText": "～～I'm so excited! I'm so impressed!",
            "nextBlock": 2,
            "origClipLength": 58,
            "animData": [
                {
                    "origLen": 69,
                    "pathId": -8616101847079983695
                },
                {
                    "origLen": 69,
                    "pathId": 5015699077159876757
                },
                {
                    "origLen": 69,
                    "pathId": -1066456505505675049
                }
            ],
            "pathId": 5531939649992030776,
            "blockIdx": 1
        },
        {
            "jpName": "秋川理事長",
            "enName": "Chairwoman Akikawa",
            "jpText": "まさにクライマックスにふさわしい\r\n最高のレースだった！",
            "enText": "It was truly a climax to a great race!",
            "nextBlock": 3,
            "origClipLength": 81,
            "choices": [
                {
                    "jpText": "ありがとうございます！",
                    "enText": "Thank you!",
                    "nextBlock": 3
                }
            ],
            "animData": [
                {
                    "origLen": 55,
                    "pathId": 2636513667234621975
                },
                {
                    "origLen": 92,
                    "pathId": -6108901795530762839
                },
                {
                    "origLen": 19,
                    "pathId": 6279301499402065927
                }
            ],
            "pathId": -5873921036042329995,
            "blockIdx": 2
        },
        {
            "jpName": "秋川理事長",
            "enName": "Chairwoman Akikawa",
            "jpText": "しかしっ！\r\n『最強』までの道のりはまだまだ遠い！",
            "enText": "But! The road to the \"Strongest\" \nis still far from over!",
            "nextBlock": 4,
            "origClipLength": 77,
            "animData": [
                {
                    "origLen": 79,
                    "pathId": 7502409570593030010
                },
                {
                    "origLen": 88,
                    "pathId": 5473183753326042878
                }
            ],
            "pathId": 6530783465702827460,
            "blockIdx": 3
        },
        {
            "jpName": "秋川理事長",
            "enName": "Chairwoman Akikawa",
            "jpText": "だからこそ、激励ッ！！\r\n<chrname>の善戦を心から祈念ッ！！",
            "enText": "That's why I'm giving you a pep talk! Wishing \n<chrname> a good fight!",
            "nextBlock": 5,
            "origClipLength": 89,
            "animData": [
                {
                    "origLen": 89,
                    "pathId": 7515624410659239267
                },
                {
                    "origLen": 100,
                    "pathId": 3245581165300755558
                }
            ],
            "pathId": 7850324947990441082,
            "blockIdx": 4
        },
        {
            "jpName": "モノローグ",
            "enName": "",
            "jpText": "そうだ、良くも悪くもあと2戦……\r\n気を抜かずにいかなければ！",
            "enText": "Yes, for better or worse, we have two more \nrounds…… We have to stay on our toes!",
            "nextBlock": -1,
            "origClipLength": 85,
            "animData": [
                {
                    "origLen": 94,
                    "pathId": 908182998969539867
                },
                {
                    "origLen": 96,
                    "pathId": -1208385177372487769
                }
            ],
            "pathId": -8437885924855296274,
            "blockIdx": 5
        },
        {
            "jpName": "秋川理事長",
            "enName": "Chairwoman Akikawa",
            "jpText": "まさにクライマックスにふさわしい\r\n最高のレースだった！",
            "enText": "It was truly a climax to a great race!",
            "nextBlock": 7,
            "origClipLength": 81,
            "animData": [
                {
                    "origLen": 55,
                    "pathId": 7751932979022951829
                },
                {
                    "origLen": 92,
                    "pathId": -3297822295200784698
                },
                {
                    "origLen": 19,
                    "pathId": -3338458470914950788
                }
            ],
            "pathId": 8606092412271626673,
            "blockIdx": 6
        },
        {
            "jpName": "秋川理事長",
            "enName": "Chairwoman Akikawa",
            "jpText": "そして――敬服ッ！\r\n<chrname>も、不屈の精神で\n次のレースを見据えているっ！",
            "enText": "And―salute! <chrname> is also looking ahead \nto the next race with fortitude!",
            "nextBlock": 8,
            "origClipLength": 101,
            "animData": [
                {
                    "origLen": 79,
                    "pathId": -2469335189918589274
                },
                {
                    "origLen": 158,
                    "pathId": -8892983084866765223
                }
            ],
            "pathId": 3013430070678587080,
            "blockIdx": 7
        },
        {
            "jpName": "秋川理事長",
            "enName": "Chairwoman Akikawa",
            "jpText": "『最強』までの道のりはまだまだ遠い！\r\nしかしっ！\n閉ざされているわけでは決してないっ！",
            "enText": "The road to \"Strongest\" is far from over! \nBut! It is by no means closed!",
            "nextBlock": 9,
            "origClipLength": 102,
            "animData": [
                {
                    "origLen": 89,
                    "pathId": -8283573384759075358
                },
                {
                    "origLen": 149,
                    "pathId": 7324725113989152769
                }
            ],
            "pathId": 974662983108896384,
            "blockIdx": 8
        },
        {
            "jpName": "秋川理事長",
            "enName": "Chairwoman Akikawa",
            "jpText": "だからこそ、激励ッ！！\r\n<chrname>の善戦を心から祈念ッ！！",
            "enText": "That's why I'm giving you a pep talk! Wishing \n<chrname> a good fight!",
            "nextBlock": 10,
            "origClipLength": 89,
            "choices": [
                {
                    "jpText": "ありがとうございます！",
                    "enText": "Thank you!",
                    "nextBlock": 10
                }
            ],
            "animData": [
                {
                    "origLen": 94,
                    "pathId": 2984003299056516479
                },
                {
                    "origLen": 143,
                    "pathId": 1781333523789051723
                }
            ],
            "pathId": -4081601850618321360,
            "blockIdx": 9
        },
        {
            "jpName": "モノローグ",
            "enName": "",
            "jpText": "そうだ、良くも悪くもあと2戦……\r\nまだまだチャンスはある！",
            "enText": "Yes, for better or worse, we still have two \nmore rounds…… to go!",
            "nextBlock": -1,
            "origClipLength": 84,
            "animData": [
                {
                    "origLen": 115,
                    "pathId": 4874972301603302800
                },
                {
                    "origLen": 143,
                    "pathId": 3184688583913360391
                }
            ],
            "pathId": 2188131321916215303,
            "blockIdx": 10
        }
    ],
    "modified": 1657215689
}