{
    "version": 5,
    "bundle": "ND67ZWBD267YJVKKVLDVBMQMQF4DD2CB",
    "type": "story",
    "storyId": "501069424",
    "title": "日本ダービーの後に・まだ蕾にて",
    "text": [
        {
            "jpName": "モノローグ",
            "enName": "",
            "jpText": "約束のダービー。サクラチヨノオーは、\r\n勝利をつかむことはできなかった。\n敗北を噛みしめ、芝を叩く彼女。",
            "enText": "The promised Derby. Sakura Chiono O was \nunable to seize victory. She bites her defeat \nand hits the turf.",
            "nextBlock": 2,
            "origClipLength": 112,
            "animData": [
                {
                    "origLen": 135,
                    "pathId": -7720678340161322696
                },
                {
                    "origLen": 145,
                    "pathId": -5158769585548809702
                }
            ],
            "pathId": -4477088867669827219,
            "blockIdx": 1
        },
        {
            "jpName": "モノローグ",
            "enName": "",
            "jpText": "だが、彼女には『強くなってマルゼンスキー\r\nと走る』という目標もまだ残っていたはずだ。\nサクラチヨノオーは涙を拭いて立ち上がる。",
            "enText": "However, she must have still had the goal of \n\"getting stronger and running with Marzenski. \nSakura Chiono wiped her tears and stood up.",
            "nextBlock": 3,
            "origClipLength": 128,
            "animData": [
                {
                    "origLen": 149,
                    "pathId": -6204123331549031964
                },
                {
                    "origLen": 151,
                    "pathId": -4247134792413071241
                }
            ],
            "pathId": -217840447963524281,
            "blockIdx": 2
        },
        {
            "jpName": "モノローグ",
            "enName": "",
            "jpText": "そんな彼女を見てマルゼンスキーは\r\n“最後の約束”を果たそう、\nと1人満足げに微笑むのだった。",
            "enText": "Seeing her like this, Marzenski \nsmiled with satisfaction as she \nfulfilled her \"last promise.",
            "nextBlock": 4,
            "origClipLength": 106,
            "animData": [
                {
                    "origLen": 14,
                    "pathId": -4552908955822550668
                },
                {
                    "origLen": 14,
                    "pathId": 8819855481089274633
                },
                {
                    "origLen": 190,
                    "pathId": -4224305411506359066
                },
                {
                    "origLen": 146,
                    "pathId": 5743798994123020759
                }
            ],
            "pathId": 6435618940051911541,
            "blockIdx": 3
        },
        {
            "jpName": "モノローグ",
            "enName": "",
            "jpText": "ライバルとの勝負はサクラチヨノオーの\r\n成長や新たな力として繋がった。これからも\n彼女たちと走り続けたいと願う彼女。だが――",
            "enText": "The competition with rivals led to Sakura \nChiono's growth and new strength. From now on \nShe hopes to continue running with them in \nthe future. But…",
            "nextBlock": 5,
            "origClipLength": 125,
            "animData": [
                {
                    "origLen": 171,
                    "pathId": 2401779128902690228
                },
                {
                    "origLen": 191,
                    "pathId": 1959459480261929904
                },
                {
                    "origLen": 14,
                    "pathId": -2607148146199269853
                },
                {
                    "origLen": 14,
                    "pathId": -5496698880358735083
                }
            ],
            "pathId": -999293312596509521,
            "blockIdx": 4
        },
        {
            "jpName": "モノローグ",
            "enName": "",
            "jpText": "その1人であったメジロアルダンが\r\n倒れてしまう。彼女の脚は今までの無理が\n影響し、非常に脆くなっていたのだ。",
            "enText": "One of them, Mejiro Aldan, collapses. \nHer legs had become very fragile \nher legs had become very fragile \nfrom the strain she had been",
            "nextBlock": 6,
            "origClipLength": 116,
            "animData": [
                {
                    "origLen": 172,
                    "pathId": 5338270294504577284
                },
                {
                    "origLen": 166,
                    "pathId": -4189510888081827862
                },
                {
                    "origLen": 163,
                    "pathId": 7748852082654018286
                },
                {
                    "origLen": 180,
                    "pathId": 967712375409070601
                },
                {
                    "origLen": 14,
                    "pathId": 4150487768279503141
                },
                {
                    "origLen": 14,
                    "pathId": -6609364630086864162
                }
            ],
            "pathId": 6316959044395729860,
            "blockIdx": 5
        },
        {
            "jpName": "モノローグ",
            "enName": "",
            "jpText": "レースの世界を去ろうとする彼女。しかし、\r\nサクラチヨノオーはライバルである自分が\nその心を必ず引き留めさせると誓うのだった。",
            "enText": "She wants to leave the racing world. However, \nSakura Chiono O, her rival to make sure her \nheart stays with her.",
            "nextBlock": -1,
            "origClipLength": 127,
            "animData": [
                {
                    "origLen": 181,
                    "pathId": -6205836946047228896
                },
                {
                    "origLen": 166,
                    "pathId": 8682330407924772951
                },
                {
                    "origLen": 164,
                    "pathId": 314225305903609234
                },
                {
                    "origLen": 180,
                    "pathId": 7509846710334630326
                }
            ],
            "pathId": 1357952896926436789,
            "blockIdx": 6
        }
    ],
    "modified": 1657444073
}