{
    "version": 5,
    "bundle": "LYB5DMAS72ZYJS5WNUISOHFBKEYNZWZE",
    "type": "story",
    "storyId": "501011601",
    "title": "今度こそ！",
    "text": [
        {
            "jpName": "グラスワンダー",
            "enName": "Grass Wonder",
            "jpText": "――前回のレースの結果から、\r\n反省すべき点がたくさん見つかりました。",
            "enText": "―The results of the last race revealed many \nthings that we need to reflect on.",
            "nextBlock": 2,
            "origClipLength": 67,
            "animData": [
                {
                    "origLen": 78,
                    "pathId": 4546386218738003005
                },
                {
                    "origLen": 78,
                    "pathId": 746444265557791198
                }
            ],
            "pathId": -6289563188953209971,
            "blockIdx": 1
        },
        {
            "jpName": "グラスワンダー",
            "enName": "Grass Wonder",
            "jpText": "そのおかげで、限られた時間の中で\r\n十全の努力をなせたつもりです。",
            "enText": "Thanks to this, I was able to make my best \nefforts within the limited time available.",
            "nextBlock": 3,
            "origClipLength": 66,
            "animData": [
                {
                    "origLen": 26,
                    "pathId": -8747274020489749791
                },
                {
                    "origLen": 77,
                    "pathId": -6769404137491786885
                }
            ],
            "pathId": 1090152928720906591,
            "blockIdx": 2
        },
        {
            "jpName": "グラスワンダー",
            "enName": "Grass Wonder",
            "jpText": "……2度と、\r\nあんな思いを味わわないために。",
            "enText": "……2 so I don't have to go through that again.",
            "nextBlock": 4,
            "origClipLength": 60,
            "choices": [
                {
                    "jpText": "今度こそ勝とう！",
                    "enText": "Let's win this time!",
                    "nextBlock": 4
                }
            ],
            "animData": [
                {
                    "origLen": 71,
                    "pathId": 6792010062937275714
                },
                {
                    "origLen": 71,
                    "pathId": -4335334627746763892
                }
            ],
            "pathId": -6645135575759986520,
            "blockIdx": 3
        },
        {
            "jpName": "グラスワンダー",
            "enName": "Grass Wonder",
            "jpText": "ふふ、次こそは後悔のない\r\n最高の結果を持ち帰って参りますね♪",
            "enText": "Next time, I will bring back the best result \nwith no regrets.",
            "nextBlock": -1,
            "origClipLength": 65,
            "animData": [
                {
                    "origLen": 71,
                    "pathId": 5747755029395933209
                },
                {
                    "origLen": 49,
                    "pathId": 1989586093009178966
                },
                {
                    "origLen": 76,
                    "pathId": -8420573964691730515
                }
            ],
            "pathId": 3508571825269540409,
            "blockIdx": 4
        }
    ],
    "modified": 1657555055
}