{
    "version": 5,
    "bundle": "MAW66B6IRIJKCDNE7RPY5KDLRT3JBXZN",
    "type": "story",
    "storyId": "501028402",
    "title": "甘くて小さいヒーロー",
    "text": [
        {
            "jpName": "モノローグ",
            "enName": "",
            "jpText": "ある日、ヒシアケボノからビコーペガサスの\n元気がないという話を聞く。\nどうやら原因はレース関係らしい。",
            "enText": "One day, I hear from Hsiakebono that Vicor \nPegasus is not doing well. Apparently, the \ncause is race-related.",
            "nextBlock": 2,
            "origClipLength": 111,
            "animData": [
                {
                    "origLen": 122,
                    "pathId": 3708366808352474611
                },
                {
                    "origLen": 122,
                    "pathId": 3092134722352959561
                },
                {
                    "origLen": 122,
                    "pathId": -2929648762332123495
                }
            ],
            "pathId": 4571590786691990171,
            "blockIdx": 1
        },
        {
            "jpName": "モノローグ",
            "enName": "",
            "jpText": "とりあえず、まずは気分転換に連れ出そうと、\nミカン狩りへ行くことに。",
            "enText": "First of all, I decided to take her out for a \nchange of pace, and we went tangerine picking.",
            "nextBlock": 3,
            "origClipLength": 89,
            "animData": [
                {
                    "origLen": 16,
                    "pathId": 6168824813536112267
                },
                {
                    "origLen": 16,
                    "pathId": 8866801880411864131
                },
                {
                    "origLen": 16,
                    "pathId": 7420043907286595771
                },
                {
                    "origLen": 129,
                    "pathId": -2965014688697449602
                },
                {
                    "origLen": 130,
                    "pathId": -4968385447922855741
                },
                {
                    "origLen": 131,
                    "pathId": 3560563274227095604
                },
                {
                    "origLen": 131,
                    "pathId": 2833954237056794821
                },
                {
                    "origLen": 131,
                    "pathId": -1429275503304308417
                },
                {
                    "origLen": 132,
                    "pathId": -2537879602637921864
                }
            ],
            "pathId": -2781554502256518462,
            "blockIdx": 2
        },
        {
            "jpName": "モノローグ",
            "enName": "",
            "jpText": "事件が発生するも、ビコーペガサスの勇気と\n諦めない心で無事解決。そんな姿を\n眩しそうに見るヒシアケボノ。",
            "enText": "The incident is solved with the courage \nof Vicor Pegasus and her never-giving-up \nspirit. The dazzling sight of Hsiayakebono \nlooks dazzled.",
            "nextBlock": 4,
            "origClipLength": 112,
            "animData": [
                {
                    "origLen": 129,
                    "pathId": 7210498465473910192
                },
                {
                    "origLen": 130,
                    "pathId": -5015055314072664824
                },
                {
                    "origLen": 131,
                    "pathId": -8387833008729347481
                },
                {
                    "origLen": 131,
                    "pathId": 2551834033388864574
                },
                {
                    "origLen": 131,
                    "pathId": -3062214280699166392
                },
                {
                    "origLen": 132,
                    "pathId": 1434879648933670221
                }
            ],
            "pathId": -8962713686873729237,
            "blockIdx": 3
        },
        {
            "jpName": "モノローグ",
            "enName": "",
            "jpText": "――帰り道。小さな体を活かせず、レースで\n思うような成績が上げられず悩んでいた\nビコーペガサスをヒシアケボノは励ます。",
            "enText": "―The way back home. Biko Pegasus, who had \nbeen struggling to make the most of her small \nbody and achieve the desired results in the \nrace, was encouraged by Hsiarakebono. Biko \nPegasus, who was struggling to make the best \nuse of her small body and achieve the results \nshe wanted in the race.",
            "nextBlock": 5,
            "origClipLength": 121,
            "animData": [
                {
                    "origLen": 20,
                    "pathId": -245572575629269553
                },
                {
                    "origLen": 156,
                    "pathId": 7320067043945065939
                },
                {
                    "origLen": 174,
                    "pathId": 2009340286391692569
                },
                {
                    "origLen": 20,
                    "pathId": -5049141698609956602
                },
                {
                    "origLen": 157,
                    "pathId": 1190369466051205175
                },
                {
                    "origLen": 173,
                    "pathId": -7051575922404001490
                }
            ],
            "pathId": -6929385502965145432,
            "blockIdx": 4
        },
        {
            "jpName": "モノローグ",
            "enName": "",
            "jpText": "『いつも前向きなビコーちゃんは、あたしの\nヒーローなんだよ』そんな言葉に背を押され、\nビコーペガサスは再び立ち上がるのだった。",
            "enText": "With these words, Biko Pegasus stood up \nagain. Biko Pegasus stood up again.",
            "nextBlock": -1,
            "origClipLength": 127,
            "animData": [
                {
                    "origLen": 139,
                    "pathId": -4251424564174341366
                },
                {
                    "origLen": 138,
                    "pathId": -8890134569379999588
                },
                {
                    "origLen": 138,
                    "pathId": -4201980695496697234
                },
                {
                    "origLen": 141,
                    "pathId": 3170867922262730114
                }
            ],
            "pathId": -7400129282547720094,
            "blockIdx": 5
        }
    ],
    "modified": 1657258135
}