{
    "version": 5,
    "bundle": "RDUCG3JXNRX63BS5X7JCQDPHMTU76HVL",
    "type": "story",
    "storyId": "501012402",
    "title": "アタシのタイマン、アンタのタイマン",
    "text": [
        {
            "jpName": "モノローグ",
            "enName": "",
            "jpText": "『桜花賞』に向けて全力のヒシアマゾン。\nトレーナーも彼女のために、\n様々な新トレーニングを考案する。",
            "enText": "Hsiamazon is giving her all in preparation \nfor the \"Sakurabana-sho\" (Cherry Blossom \nPrize). The trainer also devises various new \ntraining programs for her. various new \ntraining exercises for her.",
            "nextBlock": 2,
            "origClipLength": 110,
            "animData": [
                {
                    "origLen": 141,
                    "pathId": 7711118597000266196
                },
                {
                    "origLen": 205,
                    "pathId": -924304806950583593
                }
            ],
            "pathId": -7275502027871048540,
            "blockIdx": 1
        },
        {
            "jpName": "モノローグ",
            "enName": "",
            "jpText": "二人三脚で励む、努力の日々……！\n結果、ヒシアマゾンは大幅な成長を遂げる。",
            "enText": "Working hard together, the two of them work \nhard together. ……! As a result, Hsiamazon \nachieves significant growth.",
            "nextBlock": 3,
            "origClipLength": 93,
            "animData": [
                {
                    "origLen": 17,
                    "pathId": 5027823711577922264
                },
                {
                    "origLen": 17,
                    "pathId": 1964886998194065450
                }
            ],
            "pathId": 9028379065331308028,
            "blockIdx": 2
        },
        {
            "jpName": "モノローグ",
            "enName": "",
            "jpText": "ヒシアマゾンはトレーナーの本気を知り、\n相棒として深い信頼を寄せるようになる。\n『桜花賞』は、もうすぐだ――",
            "enText": "Hsiamazon learns of the trainer's seriousness \nand comes to trust her deeply as a partner. \nThe \"Cherry Blossom Prize\" is just around \nthe corner.",
            "nextBlock": -1,
            "origClipLength": 115,
            "animData": [
                {
                    "origLen": 162,
                    "pathId": -420511235751279727
                },
                {
                    "origLen": 205,
                    "pathId": -8649149990915941581
                }
            ],
            "pathId": -8946047570725815079,
            "blockIdx": 3
        }
    ],
    "modified": 1657229578
}