{
    "version": 5,
    "bundle": "I3B3SO3DC6IU5QJOTJZQLGQYI6CRCNAQ",
    "type": "story",
    "storyId": "501017427",
    "title": "菊花賞の後に・三冠達成",
    "text": [
        {
            "jpName": "モノローグ",
            "enName": "",
            "jpText": "三冠、達成。惜しみない歓声を噛み締め、\r\n三本の指を掲げるシンボリルドルフ。\n次は先達も走る『有馬記念』だ。",
            "enText": "The Triple Crown is accomplished. Symbol \nRudolph bites back the cheers of the crowd \nand raises three fingers. Next is the \"Arima \nKinen,\" a race that her predecessors will \nalso be running.",
            "nextBlock": 2,
            "origClipLength": 115,
            "coloredText": [
                {
                    "jpText": "有馬記念",
                    "enText": "Arima Kinen (horse racing)"
                }
            ],
            "animData": [
                {
                    "origLen": 170,
                    "pathId": 7939712356181207353
                },
                {
                    "origLen": 166,
                    "pathId": 2621336131261954843
                }
            ],
            "pathId": -2607337442083466450,
            "blockIdx": 1
        },
        {
            "jpName": "モノローグ",
            "enName": "",
            "jpText": "強者の走りを見届けたナリタブライアンが\r\n控室にきた。ヒリついた会話の中――",
            "enText": "NARITABURIAN came to the anteroom after \nwitnessing the strongman's run. In the midst \nof the flinty conversation―",
            "nextBlock": 3,
            "origClipLength": 94,
            "animData": [
                {
                    "origLen": 140,
                    "pathId": 2870196324564670238
                },
                {
                    "origLen": 166,
                    "pathId": 5585900867347843207
                },
                {
                    "origLen": 145,
                    "pathId": 2080716060090527416
                },
                {
                    "origLen": 158,
                    "pathId": 6201990572391813633
                }
            ],
            "pathId": 3011200376984327506,
            "blockIdx": 2
        },
        {
            "jpName": "モノローグ",
            "enName": "",
            "jpText": "あくまで生徒会を気にかける\r\nシンボリルドルフに、ナリタブライアンは\n鋭い指摘を投げかけるのだった。",
            "enText": "Symbol Rudolph, who was always concerned \nabout the student council, made a sharp point \nto Naritabu Naritabu Bryan made a sharp point \nto Symbolo Rudolph, who was only concerned \nabout the student council.",
            "nextBlock": -1,
            "origClipLength": 110,
            "animData": [
                {
                    "origLen": 140,
                    "pathId": 8849793913307410028
                },
                {
                    "origLen": 166,
                    "pathId": 3563612415257139833
                },
                {
                    "origLen": 145,
                    "pathId": 527895413135665031
                },
                {
                    "origLen": 158,
                    "pathId": -4670660801022647813
                }
            ],
            "pathId": -9072733299207836621,
            "blockIdx": 3
        }
    ],
    "modified": 1657239274
}