{
    "version": 5,
    "bundle": "536SYPSTN52RCODY56L67V3IB2O3ZIAV",
    "type": "story",
    "storyId": "501009601",
    "title": "",
    "text": [
        {
            "jpName": "ダイワスカーレット",
            "enName": "Daiwa Scarlet",
            "jpText": "……トレーナー、よく聞いて。",
            "enText": "Listen up…… trainers.",
            "nextBlock": 2,
            "origClipLength": 54,
            "animData": [
                {
                    "origLen": 65,
                    "pathId": 3278694027349216036
                },
                {
                    "origLen": 65,
                    "pathId": 8073903814650407656
                }
            ],
            "pathId": -502229206429322639,
            "blockIdx": 1
        },
        {
            "jpName": "ダイワスカーレット",
            "enName": "Daiwa Scarlet",
            "jpText": "この前のアタシの走りは、詰めが甘かった。\r\n悔しいけど、それを素直に認めるわ。",
            "enText": "The last time I ran, I didn't pack it in \nwell. It's frustrating, but I'll admit it.",
            "nextBlock": 3,
            "origClipLength": 70,
            "animData": [
                {
                    "origLen": 43,
                    "pathId": 7976757557707349477
                },
                {
                    "origLen": 81,
                    "pathId": -8087863667500565133
                }
            ],
            "pathId": -4357018756899544141,
            "blockIdx": 2
        },
        {
            "jpName": "ダイワスカーレット",
            "enName": "Daiwa Scarlet",
            "jpText": "だから今回のレースでは――\r\nもうあんな、情けない走りは絶対にしない。",
            "enText": "So in this race―I will never run that \npathetic again.",
            "nextBlock": 4,
            "origClipLength": 67,
            "choices": [
                {
                    "jpText": "1番の走りを見せてほしい",
                    "enText": "I want to see you run number one.",
                    "nextBlock": 4
                }
            ],
            "animData": [
                {
                    "origLen": 38,
                    "pathId": -8086987040871331096
                },
                {
                    "origLen": 78,
                    "pathId": 6027500413535092553
                }
            ],
            "pathId": -8753865330386818277,
            "blockIdx": 3
        },
        {
            "jpName": "ダイワスカーレット",
            "enName": "Daiwa Scarlet",
            "jpText": "ええ、見せてあげるわ。\r\n――アンタの期待を超えた走りをね！",
            "enText": "Yes, I'll show you. ―I'll show you… and I'll \nexceed your expectations!",
            "nextBlock": 5,
            "origClipLength": 64,
            "animData": [
                {
                    "origLen": 32,
                    "pathId": 7567118900602973444
                },
                {
                    "origLen": 75,
                    "pathId": -5338271693276525197
                }
            ],
            "pathId": -5125736996299703283,
            "blockIdx": 4
        },
        {
            "jpName": "ダイワスカーレット",
            "enName": "Daiwa Scarlet",
            "jpText": "1番はアタシよ！\r\n今度こそ……誰にも譲らないんだから！",
            "enText": "I'm number one! This time I'm \nnot giving up…… to anyone!",
            "nextBlock": -1,
            "origClipLength": 63,
            "animData": [
                {
                    "origLen": 12,
                    "pathId": 8223246093974014828
                },
                {
                    "origLen": 74,
                    "pathId": 2482652122981460751
                }
            ],
            "pathId": 7734643877648793051,
            "blockIdx": 5
        }
    ],
    "modified": 1657176601
}