{
    "version": 5,
    "bundle": "RVCZM3HEZE7QI2QWY62EJBBFDOPQVRHU",
    "type": "story",
    "storyId": "501074406",
    "title": "夏合宿（2年目）スタート！",
    "text": [
        {
            "jpName": "モノローグ",
            "enName": "",
            "jpText": "迎えた夏合宿。『菊花賞』に向け、\r\nまずはメジロブライトが行うべき\nトレーニング内容を話し合うことになった。",
            "enText": "The summer training camp has arrived. The \nfirst thing to be discussed was the training \nthat Mejiro Bright should do for \"Kikka-sho\" \n(Chrysanthemum Award). The first step was to \ndiscuss the training that Mejiro Bright \nshould do for the",
            "nextBlock": 2,
            "origClipLength": 115,
            "animData": [
                {
                    "origLen": 127,
                    "pathId": 8104093159799340308
                },
                {
                    "origLen": 127,
                    "pathId": 942965507609980515
                },
                {
                    "origLen": 127,
                    "pathId": 4063016222664221016
                },
                {
                    "origLen": 127,
                    "pathId": 8368963564214663057
                }
            ],
            "pathId": 8052006131560807970,
            "blockIdx": 1
        },
        {
            "jpName": "モノローグ",
            "enName": "",
            "jpText": "目指すレースが長距離であるならば、\r\nコーチ役も長距離に適したウマ娘に\n頼るべきだろう――",
            "enText": "If the race they are aiming for is a \nlong distance race, they should rely \non horsegirl who are suited for long \ndistance races to act as coaches.",
            "nextBlock": 3,
            "origClipLength": 103,
            "animData": [
                {
                    "origLen": 115,
                    "pathId": -6927681935617138292
                },
                {
                    "origLen": 127,
                    "pathId": -6933737753001854529
                },
                {
                    "origLen": 127,
                    "pathId": -3367036031450981409
                },
                {
                    "origLen": 115,
                    "pathId": 4404394805573640236
                }
            ],
            "pathId": 2099583886497286893,
            "blockIdx": 2
        },
        {
            "jpName": "モノローグ",
            "enName": "",
            "jpText": "新たな方針は決まり、\r\n熱い特訓の日々が幕を開けようとしていた。",
            "enText": "A new policy was set, and the days of intense \ntraining were about to begin.",
            "nextBlock": -1,
            "origClipLength": 86,
            "animData": [
                {
                    "origLen": 127,
                    "pathId": -4143436019951751923
                },
                {
                    "origLen": 127,
                    "pathId": -8846276243511408424
                },
                {
                    "origLen": 127,
                    "pathId": 55664195104714391
                },
                {
                    "origLen": 127,
                    "pathId": -4896683354805144524
                }
            ],
            "pathId": 5615442806090579743,
            "blockIdx": 3
        }
    ],
    "modified": 1657451733
}