{
    "version": 5,
    "bundle": "YG4JKR4TATKRTMTLC6LFENHICEMSJJSQ",
    "type": "story",
    "storyId": "501012416",
    "title": "安田記念にむけて",
    "text": [
        {
            "jpName": "モノローグ",
            "enName": "",
            "jpText": "『安田記念』当日、レース前の会見にて。\r\nヒシアマゾンは、強敵たちに打ち勝ち、\nさらに上を目指したい、と意気込みを語る。",
            "enText": "At the pre-race press conference on the day \nof the \"Yasuda Kinen. Hsiamazon said that she \nwas determined to overcome her strong \nopponents and She is determined to overcome \nher strong rivals and aim for a higher level \nof performance.",
            "nextBlock": 2,
            "origClipLength": 123,
            "animData": [
                {
                    "origLen": 149,
                    "pathId": 3846474456218864366
                },
                {
                    "origLen": 173,
                    "pathId": -7880657634567250407
                }
            ],
            "pathId": 4016736613323089469,
            "blockIdx": 1
        },
        {
            "jpName": "モノローグ",
            "enName": "",
            "jpText": "“女傑”の言葉に、客席は大いに沸いていた！\n多くの期待を背負い、彼女はレースに臨む――",
            "enText": "The audience was excited to hear \nthe words of the \"lady of the race\"! \nWith many expectations on her shoulders, \nshe is ready to race…",
            "nextBlock": -1,
            "origClipLength": 101,
            "animData": [
                {
                    "origLen": 16,
                    "pathId": 1893784883336025974
                },
                {
                    "origLen": 16,
                    "pathId": -3832315364105612593
                }
            ],
            "pathId": 6266657687510995961,
            "blockIdx": 2
        }
    ],
    "modified": 1657229598
}