{
    "version": 5,
    "bundle": "IH7NODQLWGMKVYUYFED7622GVOVLPXHQ",
    "type": "story",
    "storyId": "501015601",
    "title": "今度こそ！",
    "text": [
        {
            "jpName": "テイエムオペラオー",
            "enName": "TM Opera O",
            "jpText": "聞こえるよ、トレーナー君。",
            "enText": "I hear you, trainer.",
            "nextBlock": 2,
            "origClipLength": 61,
            "animData": [
                {
                    "origLen": 73,
                    "pathId": -3551574998297706103
                },
                {
                    "origLen": 72,
                    "pathId": -1527988736085987913
                },
                {
                    "origLen": 72,
                    "pathId": -3850337836018057163
                }
            ],
            "pathId": -4689239931516517554,
            "blockIdx": 1
        },
        {
            "jpName": "テイエムオペラオー",
            "enName": "TM Opera O",
            "jpText": "スタンドで、ボクの活躍を願うファンの声。\nそして――",
            "enText": "The fans in the stands, wishing \nme well. And then―",
            "nextBlock": 3,
            "origClipLength": 78,
            "animData": [
                {
                    "origLen": 18,
                    "pathId": -3252314912006184741
                },
                {
                    "origLen": 89,
                    "pathId": 194968209304683769
                },
                {
                    "origLen": 89,
                    "pathId": -7679787796752535149
                }
            ],
            "pathId": 7680160109697772738,
            "blockIdx": 2
        },
        {
            "jpName": "テイエムオペラオー",
            "enName": "TM Opera O",
            "jpText": "ボクの勝利を、復活を待ち望む\n君の心の声がね……！",
            "enText": "Your hearts long for my victory and my \nresurrection. ……!",
            "nextBlock": 4,
            "origClipLength": 77,
            "choices": [
                {
                    "jpText": "全力で応えてこい！",
                    "enText": "Go answer them with everything you've got!",
                    "nextBlock": 4
                },
                {
                    "jpText": "全力で応えてきて！",
                    "enText": "Go answer them to the best of your ability!",
                    "nextBlock": 4
                }
            ],
            "animData": [
                {
                    "origLen": 30,
                    "pathId": 2545837406342944390
                },
                {
                    "origLen": 45,
                    "pathId": -6111942415752269918
                },
                {
                    "origLen": 88,
                    "pathId": 4307663651360301912
                }
            ],
            "pathId": 8375684522449986089,
            "blockIdx": 3
        },
        {
            "jpName": "テイエムオペラオー",
            "enName": "TM Opera O",
            "jpText": "“覇王”の誇りにかけて……必ず！",
            "enText": "I'm proud to be a \"High King\"…… I promise!",
            "nextBlock": -1,
            "origClipLength": 65,
            "animData": [
                {
                    "origLen": 71,
                    "pathId": 7722600944288991238
                },
                {
                    "origLen": 62,
                    "pathId": -2090733033129664265
                },
                {
                    "origLen": 76,
                    "pathId": -717412838111694130
                }
            ],
            "pathId": 4665420020854435307,
            "blockIdx": 4
        }
    ],
    "modified": 1657555056
}